{
  "id": "e2e-test",
  "endpoint": "http://nodeA-backend:8080/discovery/e2e-test",
  "presentation_max_validity": 36000,
  "presentation_definition": {
    "id": "pd_e2e_test",
    "format": {
      "jwt_vc": {
        "alg": [
          "PS256"
        ]
      },
      "jwt_vp": {
        "alg": [
          "PS256"
        ]
      }
    },
    "input_descriptors": [
      {
        "id": "id_x509credential",
        "constraints": {
          "fields": [
            {
              "path": [
                "$.type"
              ],
              "filter": {
                "type": "string",
                "const": "X509Credential"
              }
            },
            {
              "path": [
                "$.issuer"
              ],
              "purpose": "Whe can only accept credentials from a trusted issuer",
              "filter": {
                "type": "string",
                "pattern": "^did:x509:0:sha256:KiR4I8iCKgmWkfwEPc4QDhrBhwM0gph_uMOUuV_EN0I::.*$"
              }
            },
            {
              "id": "organization_name",
              "path": [
                "$.credentialSubject[0].subject.O"
              ],
              "filter": {
                "type": "string"
              }
            },
            {
              "id": "organization_ura",
              "path": [
                "$.credentialSubject[0].san.otherName"
              ],
              "filter": {
                "type": "string",
                "pattern": "^[0-9.]+-\\d+-\\d+-S-(\\d+)-00\\.000-\\d+$"
              }
            },
            {
              "id": "organization_city",
              "path": [
                "$.credentialSubject[0].subject.L"
              ],
              "filter": {
                "type": "string"
              }
            }
          ]
        }
      }
    ]
  }
}
