{
  "id": "e2e-test",
  "endpoint": "http://nodeA-backend:8080/discovery/e2e-test",
  "presentation_max_validity": 36000,
  "presentation_definition": {
    "id": "pd_eoverdracht_dev_care_organization",
    "format": {
      "ldp_vc": {
        "proof_type": [
          "JsonWebSignature2020"
        ]
      }
    },
    "input_descriptors": [
      {
        "id": "id_nuts_care_organization_cred",
        "constraints": {
          "fields": [
            {
              "path": [
                "$.type"
              ],
              "filter": {
                "type": "string",
                "const": "NutsOrganizationCredential"
              }
            },
            {
              "path": [
                "$.credentialSubject.organization.name",
                "$.credentialSubject[0].organization.name"
              ],
              "filter": {
                "type": "string"
              }
            },
            {
              "path": [
                "$.credentialSubject.organization.city",
                "$.credentialSubject[0].organization.city"
              ],
              "filter": {
                "type": "string"
              }
            }
          ]
        }
      }
    ]
  }
}
